{
  "algorithm": "sha256",
  "api_version": "v1",
  "authority": {
    "authoritative": false,
    "protocol": "RAPP/1",
    "statement": "This generated static discovery surface is non-authoritative. Signed RAPP/1 frames and signed RAPP/1 registries remain the authority.",
    "verification_required": true
  },
  "count": 2,
  "current": "52a52904119ff07a5b46e64efc69b2e139b2f80012db35dd3e8a57b610e16019",
  "fixture_mode": false,
  "generated": "2026-09-18T14:59:20Z",
  "receipts": [
    {
      "binding": {
        "kind": "content-addressed-artifact-snapshot",
        "pages_url": "https://kody-w.github.io/rapp-static-apis/api/rapp-work/v1/receipts/artifacts/sha256/817f5c2aaaa6aaa13f761de5a0a2661a59d43276c75c76da93964816f7db3f57.json",
        "path": "api/rapp-work/v1/receipts/artifacts/sha256/817f5c2aaaa6aaa13f761de5a0a2661a59d43276c75c76da93964816f7db3f57.json",
        "raw_url": "https://raw.githubusercontent.com/kody-w/rapp-static-apis/main/api/rapp-work/v1/receipts/artifacts/sha256/817f5c2aaaa6aaa13f761de5a0a2661a59d43276c75c76da93964816f7db3f57.json",
        "sha256": "817f5c2aaaa6aaa13f761de5a0a2661a59d43276c75c76da93964816f7db3f57"
      },
      "generated": "2026-09-18T14:59:20Z",
      "manifest_sha256": "6c49a3049e86aa1eaafad2276eea1caa77de3cf6baee06995f2cfe6db5ac15fa",
      "pages_url": "https://kody-w.github.io/rapp-static-apis/api/rapp-work/v1/receipts/sha256/52a52904119ff07a5b46e64efc69b2e139b2f80012db35dd3e8a57b610e16019.json",
      "path": "api/rapp-work/v1/receipts/sha256/52a52904119ff07a5b46e64efc69b2e139b2f80012db35dd3e8a57b610e16019.json",
      "raw_url": "https://raw.githubusercontent.com/kody-w/rapp-static-apis/main/api/rapp-work/v1/receipts/sha256/52a52904119ff07a5b46e64efc69b2e139b2f80012db35dd3e8a57b610e16019.json",
      "sha256": "52a52904119ff07a5b46e64efc69b2e139b2f80012db35dd3e8a57b610e16019"
    },
    {
      "binding": {
        "kind": "content-addressed-artifact-snapshot",
        "pages_url": "https://kody-w.github.io/rapp-static-apis/api/rapp-work/v1/receipts/artifacts/sha256/5ec867b802488ecb30d44d134b0dff714d51de29fa90936f6a8635cf524d90cd.json",
        "path": "api/rapp-work/v1/receipts/artifacts/sha256/5ec867b802488ecb30d44d134b0dff714d51de29fa90936f6a8635cf524d90cd.json",
        "raw_url": "https://raw.githubusercontent.com/kody-w/rapp-static-apis/main/api/rapp-work/v1/receipts/artifacts/sha256/5ec867b802488ecb30d44d134b0dff714d51de29fa90936f6a8635cf524d90cd.json",
        "sha256": "5ec867b802488ecb30d44d134b0dff714d51de29fa90936f6a8635cf524d90cd"
      },
      "generated": "2026-09-18T14:59:20Z",
      "manifest_sha256": "fd1615ee12d54fd511be2cf5b84a1fbff714fb27fd60d68862a0a7a7f5be3006",
      "pages_url": "https://kody-w.github.io/rapp-static-apis/api/rapp-work/v1/receipts/sha256/ab208e8c6fcca29455ade5eab79155046e24c65ca02a9e16274f6343c8241f9d.json",
      "path": "api/rapp-work/v1/receipts/sha256/ab208e8c6fcca29455ade5eab79155046e24c65ca02a9e16274f6343c8241f9d.json",
      "raw_url": "https://raw.githubusercontent.com/kody-w/rapp-static-apis/main/api/rapp-work/v1/receipts/sha256/ab208e8c6fcca29455ade5eab79155046e24c65ca02a9e16274f6343c8241f9d.json",
      "sha256": "ab208e8c6fcca29455ade5eab79155046e24c65ca02a9e16274f6343c8241f9d"
    }
  ],
  "schema": "rapp-work-static-api-receipts-index/1.0"
}
